id                                  ,code,label_de                                                                                              ,label_fr                                                                                                     ,label_it                                                                                                  ,label_en
b39244bc-45d5-4c73-a142-efca932ca2f1,842 ,Mittelschullehrer/innen                                                                               ,"Professeurs de l'enseignement secondaire (lycée, collège)"                                                  ,Insegnanti di scuole medio superiori                                                                      ,
0d2bb33e-3c81-45f6-84ca-11de7017ee2f,843 ,Oberstufenlehrer/innen                                                                                ,Enseignants des classes supérieures de l'enseignement secondaire                                             ,Insegnanti di scuole secondarie                                                                           ,
47cb1534-6feb-4a19-b323-f3f258463a7e,844 ,Primarlehrer/innen                                                                                    ,Instituteurs (école primaire)                                                                                ,Insegnanti di scuole elementari                                                                           ,
101ac0cf-5284-4030-a40f-583ff8d12fb9,845 ,Lehrer/innen des Vorschulunterrichts                                                                  ,Enseignants du degré préscolaire                                                                             ,Insegnanti del settore prescolastico                                                                      ,
78c75197-01fa-4059-81c6-1590493d87c9,846 ,"Berufs-, Fach- und Sonderschullehrer/innen"                                                          ,"Professeurs d'école professionnelle, spécialisée ou à programme d'enseignement spécial"                     ,"Insegnanti di scuole professionali, scuole specializzate e scuole speciali"                              ,
60774443-fa30-44fd-b0f8-1409b8bd95ef,847 ,Übrige Lehrkräfte und Pädagogen                                                                       ,Autres enseignants et pédagogues                                                                             ,Altri insegnanti ed educatori                                                                             ,
09ccfd18-4b2a-4d37-9eb6-77dcb4a1f91e,851 ,"Berufe der Wirtschafts- und Sozialwissenschaften, Berufsberater/innen und Psychologen/Psychologinnen","Professions des sciences économiques et sociales, conseillers d'orientation professionnelle et psychologues","Specialisti in scienze economiche e sociali, orientatori professionali e psicologi"                      ,
4d159ee0-6efa-4e22-b277-bb6c7c0f6474,852 ,Berufe der Geisteswissenschaften                                                                      ,Professions des sciences humaines                                                                            ,Professioni relative alle scienze umanistiche                                                             ,
16c81a1a-9b78-4dcd-a3c3-fbd9dda15200,853 ,Berufe der Naturwissenschaften                                                                        ,"Professions des sciences naturelles, physiques et exactes "                                                 ,Professioni relative alle scienze naturali                                                                ,
54b29a35-a54d-4ed7-b96c-a9c3f5cb6b3a,861 ,Berufe der Humanmedizin und Pharmazie                                                                 ,Professions de la médecine humaine et de la pharmacie                                                        ,Professioni della medicina e farmacia                                                                     ,
1f064c0f-55b7-44fd-ad69-faab290d3229,862 ,Berufe der Therapie und der medizinischen Technik                                                     ,Professions de la thérapeutique et de la technique médicale                                                  ,Professioni terapeutiche e tecnico-sanitarie                                                              ,
9022527b-eeb8-4a65-b0c4-16e4fea7f6fd,863 ,Berufe der Zahnpflege                                                                                 ,Professions des soins dentaires                                                                              ,Professioni della cura dei denti                                                                          ,
fd408625-9f07-49ff-9aa5-0225107a372e,864 ,Berufe der Tiermedizin                                                                                ,Professions de la médecine vétérinaire                                                                       ,Professioni della veterinaria                                                                             ,
6ae5da6e-2ebc-4c99-9d50-a0411a25f25d,865 ,Pflegeberufe                                                                                          ,Auxiliaires soignants                                                                                        ,Professioni paramediche                                                                                   ,
fdf2591e-506e-4c2e-b8b7-25c98d07e1d2,871 ,Berufe des Sports und der Unterhaltung                                                                ,Professions du sport et du divertissement                                                                    ,Professioni dello sport e del divertimento                                                                ,
17462a55-6718-46e6-8f5a-d92e5f86afec,911 ,"Dienstleistungsberufe, wna"                                                                          ,Professions du secteur tertiaire spa                                                                         ,Professioni del settore dei servizi n.i.a.                                                                ,
54e6e476-4884-4e09-b39e-8c8bbe689549,921 ,Arbeitskräfte mit nicht bestimmbarer Berufstätigkeit                                                  ,Personnes dont l'activité professionnelle ne peut pas être définie                                           ,Personale con attività professionale non definibile                                                       ,
4a16fcff-43d6-421a-b070-220d303189ba,931 ,Berufsunabhängige Ausbildungsabschlüsse                                                               ,"Diplômes de fin d'études, non axés sur une profession spécifique"                                           ,Formazioni concluse non riferite ad una professione                                                       ,
